,Unnamed: 0,description,imageurl,name,price,price_new
0,0,Red Dracena Plant,https://d3cif2hu95s88v.cloudfront.net/live-site-2016/product-image/NEW/16169496385-600x600.jpg,Red Dracena Marginata Plant,699,630
1,1,King Queen Plant Pots Combo,https://d3cif2hu95s88v.cloudfront.net/live-site-2016/product-image/IMG/16042336707-600x600.jpg,Pair of Care Plants,899,899
2,2,Haworthia Limifolia Succulent Plant,https://d3cif2hu95s88v.cloudfront.net/live-site-2016/product-image/IMG/15904956771-600x600.jpg,Haworthia Limifolia Succulent Plant,399,399
3,3,Fiscus Tree Plant in Designer Pot,https://d3cif2hu95s88v.cloudfront.net/live-site-2016/product-image/IMG/16042354284-600x600.jpg,Cute Desk Plant,699,599
4,4,Jade Plant in Designer Pot,https://d3cif2hu95s88v.cloudfront.net/live-site-2016/product-image/IMG/16042330648-600x600.jpg,Emily Jade Plant,599,599
5,5,One White Syngonium Terrarium Plant in Glass Vase,https://d3cif2hu95s88v.cloudfront.net/live-site-2016/product-image/IMG/15757232768-600x600.jpg,White Syngonium Terrarium Plant,649,649
6,6,One Sketcth Art Personalised Mug with Jade Terrarium Plant,https://d3cif2hu95s88v.cloudfront.net/live-site-2016/product-image/27042019/IMG_7885-600x600.jpg,An Attractive Surprise,599,599
7,7,Crasulla Ovata Plant,https://d3cif2hu95s88v.cloudfront.net/live-site-2016/product-image/NEW/16169483122-600x600.jpg,Lush Potted Crasulla Ovata Plant,799,759
8,8,One Snake Terrarium Plant in Glass Vase,https://d3cif2hu95s88v.cloudfront.net/live-site-2016/product-image/IMG/15757201656-600x600.jpg,Snake Terrariuim Plant,699,699
9,9,2 Dairy Milk Silk Chocolate (65 gm) with One White Pothos Plant in Red Round Pot,https://d3cif2hu95s88v.cloudfront.net/live-site-2016/product-image/IMG/15757177193-600x600.jpg,Sweet Caring Combo,699,699
10,10,Sansevieria plant in a vase wrapped with yellow jute,https://d3cif2hu95s88v.cloudfront.net/live-site-2016/product-image/23102019/DSC_6024-600x600.jpg,Easy Care Sansevieria,599,599
11,11,Fern Plant is Designer Pot,https://d3cif2hu95s88v.cloudfront.net/live-site-2016/product-image/IMG/16041308611-600x600.jpg,Fern Merry Plant,649,649
12,12,Aglaonema Plant in Plastic Pot,https://d3cif2hu95s88v.cloudfront.net/live-site-2016/product-image/NEW/16169492834-600x600.jpg,Earthy Aglaonema Plant,899,849
13,13,One Money Plant in Designer Pot Wrapped with Jute and a small heart design on it,https://d3cif2hu95s88v.cloudfront.net/live-site-2016/product-image/IMG/157986891119-600x600.jpg,Jovial Money Plant,649,649
14,14,One Sedum Succulent Plant in Buddha Face Pot,https://d3cif2hu95s88v.cloudfront.net/live-site-2016/product-image/009/1553765680IMG_5524-600x600.jpg,Soothe Your Soul,999,999
15,15,2 Layer lucky bambo in a glass vase with Teddy bear (6 inch) and 2 Cadbury Dairy Milk Silk,https://d3cif2hu95s88v.cloudfront.net/live-site-2016/product-image/010/29-09-2018/1542090944DSC_6595-600x600.jpg,Exclusive Silk Hamper,1195,1195
16,16,Chlorophytum Plant,https://d3cif2hu95s88v.cloudfront.net/live-site-2016/product-image/NEW/16169520128-600x600.jpg,Royal Chlorophytum Plant,599,599
17,17,Zebra Cactus Plant,https://d3cif2hu95s88v.cloudfront.net/live-site-2016/product-image/IMG/16042328109-600x600.jpg,Loving Zebra Cactus Plant,699,699
18,18,"A Basket Arrangement of 8 Pink roses, 8 Cadbury's Dairy Milk of 13 gms each and a pink Teddy bear (6 Inches) with dracaena leaves with 2 layer Lucky Bamboo Plant",https://d3cif2hu95s88v.cloudfront.net/live-site-2016/product-image/04042018/DSC_0686-600x600.jpg,Lucky Hamper,1295,1295
19,19,Syngonium Plant in Personalised Newspaper Theme Red Handle Mug for Anniversary,https://d3cif2hu95s88v.cloudfront.net/live-site-2016/product-image/IMG/15779675462-600x600.jpg,Syngonium Plant in Personalised News Mug,649,649
20,20,Syngonium Plant in King Designer Pot,https://d3cif2hu95s88v.cloudfront.net/live-site-2016/product-image/IMG/16042359163-600x600.jpg,King Syngonium Plant,649,649
21,21,Lustrous Snake Plant,https://d3cif2hu95s88v.cloudfront.net/live-site-2016/product-image/Oscar/16261647526-600x600.jpg,Lustrous Snake Plant,1149,1149
22,22,Cryptanthus Plant ,https://d3cif2hu95s88v.cloudfront.net/live-site-2016/product-image/NEW/16169524239-600x600.jpg,Cryptanthus Crown Plant,799,745
23,23,One Money Plant In White Plastic Pot,https://d3cif2hu95s88v.cloudfront.net/live-site-2016/product-image/22072019/IMG_4591-600x600.jpg,Prosperous Money Plant ,599,599
24,24,Send Online Plants,https://d3cif2hu95s88v.cloudfront.net/live-site-2016/product-image/IMG/1575094463Peace-600x600.jpg,Lily Pot Of Peace,849,849
25,25,One Araucaria Christmas Tree Plant in White Plastic Pot,https://d3cif2hu95s88v.cloudfront.net/live-site-2016/product-image/IMG/15768506464-600x600.jpg,Araucaria Plant,699,699
26,26,Chocolate Plant Hamper,https://d3cif2hu95s88v.cloudfront.net/live-site-2016/product-image/IMG/16041342542-600x600.jpg,Gratifying Birthday Love,1500,1245
27,27,Peace Lily Multi Color Planter,https://d3cif2hu95s88v.cloudfront.net/live-site-2016/product-image/Oscar/16261645055-600x600.jpg,Peace Lily Multi Color Planter,1299,1299
28,28,One Money Plant Terrarium in a Glass Vase,https://d3cif2hu95s88v.cloudfront.net/live-site-2016/product-image/IMG/15737344063-600x600.jpg,Terrarium Money Plant,549,549
29,29,Spider Plant in Pot,https://d3cif2hu95s88v.cloudfront.net/live-site-2016/product-image/NEW/16169466551-600x600.jpg,Spider Plant in Owl Pot,745,699
30,30,Syngonium Plant with Chocolate Pouch,https://d3cif2hu95s88v.cloudfront.net/live-site-2016/product-image/IMG/160423212411-600x600.jpg,Syngonium Kisses,799,799
31,31,One Sanseveria (Snake) Plant in a White Plastic Pot,https://d3cif2hu95s88v.cloudfront.net/live-site-2016/product-image/IMG/15747512755-600x600.jpg,Sansevieria Air Purifying Plant,599,599
32,32,One 2 Layer Lucky Bamboo and Glass Vase covered with 8 DairyMilk Chocolates (13.2 gm),https://d3cif2hu95s88v.cloudfront.net/live-site-2016/product-image/03042019/IMG_6188-600x600.jpg,Wishing Luck ,799,799
33,33,Syngonium Plant in Personalised Pot ,https://d3cif2hu95s88v.cloudfront.net/live-site-2016/product-image/IMG/16042941861-600x600.jpg,5 Star Syngonium Plant,699,699
34,34,White Pothos Plant,https://d3cif2hu95s88v.cloudfront.net/live-site-2016/product-image/NEW/161695281310-600x600.jpg,Leafy White Pothos Plant,699,599
35,35,Plant Gift Delivery,https://d3cif2hu95s88v.cloudfront.net/live-site-2016/product-image/19042019/IMG_7599-600x600.jpg,Luck N Love,649,649
36,36,One Jade Plant in Owl Shape Pot,https://d3cif2hu95s88v.cloudfront.net/live-site-2016/product-image/009/1553768895IMG_5572-600x600.jpg,Wish Me Good Luck,749,749
37,37,One Personalised Red Heart Handle Ceramic Mug with Jade Plant for Her,https://d3cif2hu95s88v.cloudfront.net/live-site-2016/product-image/009/1554469726IMG_5920-600x600.jpg,Jade Hamper ,899,599
